Name, Link
Timeline Presentation Templates,https://24slides.com/templates/view/organization-planning/timeline-presentation-templates
To-do Checklist PowerPoint Template,https://24slides.com/templates/view/organization-planning/to-do-checklist-powerpoint-template
Transition Plan Template,https://24slides.com/templates/view/corporate-business-models/transition-plan-template
Tree Diagram PowerPoint Template,https://24slides.com/templates/view/organization-planning/tree-diagram-powerpoint-template
Triangle Graphs for Creative Presentations,https://24slides.com/templates/view/other/triangle-graphs-for-creative-presentations
Twitter Campaign Slide Deck Template,https://24slides.com/templates/view/corporate-business-models/twitter-campaign-slide-deck-template
USA Map PowerPoint Template,https://24slides.com/templates/view/maps/usa-map-powerpoint-template
Ultimate SWOT Analysis Template Pack,https://24slides.com/templates/view/corporate-business-models/ultimate-swot-analysis-template-pack
United States Map Infographic Template,https://24slides.com/templates/view/maps/united-states-map-infographic-template
United States of America PowerPoint Presentation,https://24slides.com/templates/view/other/united-states-of-america-powerpoint-presentation
User Persona PowerPoint Template,https://24slides.com/templates/view/corporate-business-models/user-persona-powerpoint-template
Value Chain Analysis Template,https://24slides.com/templates/view/corporate-business-models/value-chain-analysis-template
Value Proposition Canvas Template,https://24slides.com/templates/view/corporate-business-models/value-proposition-canvas-template
Value Stream Mapping Template,https://24slides.com/templates/view/corporate-business-models/value-stream-mapping-template
Venn Diagram PowerPoint Template,https://24slides.com/templates/view/data-tables-graphs-charts/venn-diagram-powerpoint-template
Venn Diagram Presentation Template,https://24slides.com/templates/view/data-tables-graphs-charts/venn-diagram-presentation-template
Video Game Pitch Deck Template,https://24slides.com/templates/view/corporate-business-models/video-game-pitch-deck-template
Watercolor PowerPoint Template,https://24slides.com/templates/view/other/watercolor-powerpoint-template
Waterfall Diagram PowerPoint Template,https://24slides.com/templates/view/organization-planning/waterfall-diagram-powerpoint-template
Weekly Plan PowerPoint Template,https://24slides.com/templates/view/organization-planning/weekly-plan-powerpoint-template
Weekly Status Report Template,https://24slides.com/templates/view/organization-planning/weekly-status-report-template
Wheel of Fortune Game PowerPoint Template,https://24slides.com/templates/view/other/wheel-of-fortune-game-powerpoint-template
Wheel of Fortune PowerPoint Template,https://24slides.com/templates/view/other/wheel-of-fortune-powerpoint-template
Women Leadership Powerpoint Template,https://24slides.com/templates/view/organization-planning/women-leadership-powerpoint-template
Work Plan PowerPoint Template,https://24slides.com/templates/view/organization-planning/work-plan-powerpoint-template
Workflow PowerPoint Template,https://24slides.com/templates/view/organization-planning/workflow-powerpoint-template
Workout Program PowerPoint Template,https://24slides.com/templates/view/other/workout-program-powerpoint-template
Workshop PowerPoint Presentation,https://24slides.com/templates/view/corporate-business-models/workshop-powerpoint-presentation
World Globe PowerPoint Template,https://24slides.com/templates/view/other/world-globe-powerpoint-template
World Map PowerPoint Template,https://24slides.com/templates/view/maps/world-map-powerpoint-template
