Name, Link
Generic Text Presentation Templates,https://24slides.com/templates/view/corporate-business-models/generic-text-presentation-templates
Generic Text Slides Templates,https://24slides.com/templates/view/text-slides/generic-text-slides-templates
Geography Presentation Template,https://24slides.com/templates/view/other/geography-presentation-template
Go To Market Strategy Template,https://24slides.com/templates/view/corporate-business-models/go-to-market-strategy-template
Graph, Diagram & Data Sheet PowerPoint Template,https://24slides.com/templates/view/data-tables-graphs-charts/graph-diagram-data-sheet-powerpoint-template
Growth Process PowerPoint Template,https://24slides.com/templates/view/organization-planning/growth-process-powerpoint-template
HR Presentation Slide Templates,https://24slides.com/templates/view/organization-planning/hr-presentation-slide-templates
Halloween PowerPoint Template,https://24slides.com/templates/view/organization-planning/halloween-powerpoint-template
Hand Hygiene PowerPoint Template,https://24slides.com/templates/view/other/hand-hygiene-powerpoint-template
Happy New Year Template,https://24slides.com/templates/view/other/happy-new-year-template
Happy Thanksgiving PowerPoint Template,https://24slides.com/templates/view/text-slides/happy-thanksgiving-powerpoint-template
Health Care PowerPoint Template,https://24slides.com/templates/view/other/health-care-powerpoint-template
Heart Disease Prevention PowerPoint Template,https://24slides.com/templates/view/other/heart-disease-prevention-powerpoint-template
ICO (Initial Coin Offering) PowerPoint Template,https://24slides.com/templates/view/corporate-business-models/ico-initial-coin-offering-powerpoint-template
IT Network PowerPoint Template,https://24slides.com/templates/view/other/it-network-powerpoint-template
Infographic Presentation Template,https://24slides.com/templates/view/other/infographic-presentation-template
Interactive Product Presentation Template,https://24slides.com/templates/view/other/interactive-product-presentation-template
Investor Relations PowerPoint Template,https://24slides.com/templates/view/corporate-business-models/investor-relations-powerpoint-template
Investor Relations Presentation Template,https://24slides.com/templates/view/text-slides/investor-relations-presentation-template
Jeopardy Game Template,https://24slides.com/templates/view/other/jeopardy-game-template
Leadership PowerPoint Presentation,https://24slides.com/templates/view/corporate-business-models/leadership-powerpoint-presentation
Lessons Learned Powerpoint Template,https://24slides.com/templates/view/corporate-business-models/lessons-learned-powerpoint-template
Lessons Learned Presentation Template,https://24slides.com/templates/view/corporate-business-models/lessons-learned-presentation-template
Life-cycle Diagram PowerPoint Template,https://24slides.com/templates/view/organization-planning/life-cycle-diagram-powerpoint-template
Light Corporate PowerPoint Template Pack,https://24slides.com/templates/view/corporate-business-models/light-corporate-powerpoint-template-pack
Logic Model PowerPoint Template,https://24slides.com/templates/view/corporate-business-models/logic-model-powerpoint-template
Logistics Services Presentation Template,https://24slides.com/templates/view/corporate-business-models/logistics-services-presentation-template
Macroeconomics PowerPoint Template,https://24slides.com/templates/view/corporate-business-models/macroeconomics-powerpoint-template
Management Consulting PowerPoint Template Pack,https://24slides.com/templates/view/corporate-business-models/management-consulting-powerpoint-template-pack
Management Human Resource Icons,https://24slides.com/templates/view/other/management-human-resource-icons
Management Strategy PowerPoint Template,https://24slides.com/templates/view/corporate-business-models/management-strategy-powerpoint-template
Management Teamwork PowerPoint Template,https://24slides.com/templates/view/organization-planning/management-teamwork-powerpoint-template
Manufacturing Icons Template Pack,https://24slides.com/templates/view/other/manufacturing-icons-template-pack
Maps of the World PowerPoint Template,https://24slides.com/templates/view/maps/maps-of-the-world-powerpoint-template
Marketing Analysis PowerPoint Presentation,https://24slides.com/templates/view/corporate-business-models/marketing-analysis-powerpoint-presentation
Marketing Mix PowerPoint Template,https://24slides.com/templates/view/corporate-business-models/marketing-mix-powerpoint-template
Marketing Strategy PowerPoint Template,https://24slides.com/templates/view/corporate-business-models/marketing-strategy-powerpoint-template
Matrix Chart PowerPoint Template,https://24slides.com/templates/view/data-tables-graphs-charts/matrix-chart-powerpoint-template
McKinsey PowerPoint Presentation Template,https://24slides.com/templates/view/corporate-business-models/mckinsey-powerpoint-presentation-template
Mechanical Gear PowerPoint Template,https://24slides.com/templates/view/other/mechanical-gear-powerpoint-template
Medical PowerPoint Template,https://24slides.com/templates/view/other/medical-powerpoint-template
Meet The Team PowerPoint Template,https://24slides.com/templates/view/text-slides/meet-the-team-powerpoint-template
Mental Health Awareness PowerPoint Presentation,https://24slides.com/templates/view/other/mental-health-awareness-powerpoint-presentation
Mexican Market Presentation Template,https://24slides.com/templates/view/other/mexican-market-presentation-template
Microbiology Research Presentation Template,https://24slides.com/templates/view/other/microbiology-research-presentation-template
Milestone Roadmap PowerPoint Template,https://24slides.com/templates/view/organization-planning/milestone-roadmap-powerpoint-template
Minimalist Environmental Presentation Template,https://24slides.com/templates/view/other/minimalist-environmental-presentation-template
Minimalist PowerPoint Slides,https://24slides.com/templates/view/text-slides/minimalist-powerpoint-slides
Mining Industry Icons,https://24slides.com/templates/view/other/mining-industry-icons
Mobile Application PowerPoint Template,https://24slides.com/templates/view/other/mobile-application-powerpoint-template
Mobile Sales Slides Template,https://24slides.com/templates/view/corporate-business-models/mobile-sales-slides-template
Modern Newspaper Template,https://24slides.com/templates/view/text-slides/modern-newspaper-template
Modern Office Design PowerPoint Template,https://24slides.com/templates/view/other/modern-office-design-powerpoint-template
North American Map PowerPoint Template,https://24slides.com/templates/view/maps/north-american-map-powerpoint-template
Nutrition PowerPoint Template,https://24slides.com/templates/view/other/nutrition-powerpoint-template
Oil and Gas Industry Icon,https://24slides.com/templates/view/other/oil-and-gas-industry-icon
Oil and Gas Presentation Template,https://24slides.com/templates/view/other/oil-and-gas-presentation-template
Online Course Presentation Template,https://24slides.com/templates/view/other/online-course-presentation-template
Online Recruitment Presentation Template,https://24slides.com/templates/view/corporate-business-models/online-recruitment-presentation-template
Online Shopping Presentation Template,https://24slides.com/templates/view/other/online-shopping-presentation-template
Organic Food Store PowerPoint Presentation,https://24slides.com/templates/view/other/organic-food-store-powerpoint-presentation
Organizational Chart PowerPoint Template,https://24slides.com/templates/view/data-tables-graphs-charts/organizational-chart-powerpoint-template
Organizational Chart Templates,https://24slides.com/templates/view/organization-planning/organizational-chart-templates
PEST Diagram PowerPoint Template,https://24slides.com/templates/view/organization-planning/pest-diagram-powerpoint-template
Parenting PowerPoint Presentation,https://24slides.com/templates/view/other/parenting-powerpoint-presentation
Personal Resume PowerPoint Template,https://24slides.com/templates/view/other/personal-resume-powerpoint-template
Pharmaceutical Icons Template Pack,https://24slides.com/templates/view/other/pharmaceutical-icons-template-pack
Pharmaceutical PowerPoint Template,https://24slides.com/templates/view/other/pharmaceutical-powerpoint-template
Physical Science PowerPoint Template,https://24slides.com/templates/view/other/physical-science-powerpoint-template
Pie Chart PowerPoint Template,https://24slides.com/templates/view/data-tables-graphs-charts/pie-chart-powerpoint-template
Pillars for PowerPoint Presentations,https://24slides.com/templates/view/corporate-business-models/pillars-for-powerpoint-presentations
Pitch Deck 3,https://24slides.com/templates/view/corporate-business-models/pitch-deck-3
Pitch Deck PowerPoint Template,https://24slides.com/templates/view/organization-planning/pitch-deck-powerpoint-template
Pitch Deck Presentation Templates,https://24slides.com/templates/view/corporate-business-models/pitch-deck-presentation-templates
Pizza PowerPoint Template,https://24slides.com/templates/view/text-slides/pizza-powerpoint-template
Planning Icons PowerPoint Template,https://24slides.com/templates/view/organization-planning/planning-icons-powerpoint-template
Planning Slides PowerPoint Template Pack,https://24slides.com/templates/view/organization-planning/planning-slides-powerpoint-template-pack
Playful Brainstorming Session Template,https://24slides.com/templates/view/corporate-business-models/playful-brainstorming-session-template
Playful Budget PowerPoint Template,https://24slides.com/templates/view/corporate-business-models/playful-budget-powerpoint-template
Playful Christmas Template,https://24slides.com/templates/view/other/playful-christmas-template
Playful Comparison Template,https://24slides.com/templates/view/other/playful-comparison-template
Playful Consumer Goods Icon,https://24slides.com/templates/view/other/playful-consumer-goods-icon
Playful Environmental Slides Deck Template,https://24slides.com/templates/view/other/playful-environmental-slides-deck-template
Playful Facebook Report Template,https://24slides.com/templates/view/other/playful-facebook-report-template
Playful Human Resource Management Icons,https://24slides.com/templates/view/other/playful-human-resource-management-icons
Playful Icons for Start-up Entrepreneur,https://24slides.com/templates/view/other/playful-icons-for-start-up-entrepreneur
Playful Infographic PowerPoint Template,https://24slides.com/templates/view/other/playful-infographic-powerpoint-template
Playful Japanese Presentation,https://24slides.com/templates/view/text-slides/playful-japanese-presentation
Playful Mega Pack Slide PowerPoint Template,https://24slides.com/templates/view/corporate-business-models/playful-mega-pack-slide-powerpoint-template
Playful Pharmaceutical Icon,https://24slides.com/templates/view/other/playful-pharmaceutical-icon
Playful Pitch Deck PowerPoint Template,https://24slides.com/templates/view/corporate-business-models/playful-pitch-deck-powerpoint-template
Playful Process Map Template,https://24slides.com/templates/view/maps/playful-process-map-template
Playful Puzzle PowerPoint Template,https://24slides.com/templates/view/other/playful-puzzle-powerpoint-template
Playful SWOT PowerPoint Template,https://24slides.com/templates/view/corporate-business-models/playful-swot-powerpoint-template
Playful Science Pharmaceutical PowerPoint Template,https://24slides.com/templates/view/other/playful-science-pharmaceutical-powerpoint-template
Playful Scrum Process PowerPoint Template,https://24slides.com/templates/view/corporate-business-models/playful-scrum-process-powerpoint-template
Playful Social Media Template,https://24slides.com/templates/view/other/playful-social-media-template
Playful Venn Diagram PowerPoint Template,https://24slides.com/templates/view/data-tables-graphs-charts/playful-venn-diagram-powerpoint-template
Playful Yoga PowerPoint Template,https://24slides.com/templates/view/other/playful-yoga-powerpoint-template
Porter’s Five Forces Analysis Template,https://24slides.com/templates/view/corporate-business-models/porters-five-forces-analysis-template
Porter’s Five Forces PowerPoint Template,https://24slides.com/templates/view/corporate-business-models/porters-five-forces-powerpoint-template
Porter’s Five Forces Slides,https://24slides.com/templates/view/corporate-business-models/porters-five-forces-slides
PowerPoint Backgrounds Template,https://24slides.com/templates/view/other/powerpoint-backgrounds-template
PowerPoint Slides with Video Template,https://24slides.com/templates/view/other/powerpoint-slides-with-video-template
Presentation Business Icons,https://24slides.com/templates/view/corporate-business-models/presentation-business-icons
Presentation Checklist Template Pack,https://24slides.com/templates/view/organization-planning/presentation-checklist-template-pack
Presentation Data Icons,https://24slides.com/templates/view/other/presentation-data-icons
Presentation Template Leadership Women,https://24slides.com/templates/view/organization-planning/presentation-template-leadership-women
Presentation Template Maps: Europe,https://24slides.com/templates/view/maps/presentation-template-maps-europe
Presentation Template Maps: North America,https://24slides.com/templates/view/maps/presentation-template-maps-north-america
Presentation Template Maps: South America,https://24slides.com/templates/view/maps/presentation-template-maps-south-america
Presentation Template for Revenue Data,https://24slides.com/templates/view/data-tables-graphs-charts/presentation-template-for-revenue-data
Presenting 'About Me' PowerPoint Template,https://24slides.com/templates/view/other/presenting-about-me-powerpoint-template
Problem Solving PowerPoint Template,https://24slides.com/templates/view/corporate-business-models/problem-solving-powerpoint-template
Process Slide PowerPoint Template,https://24slides.com/templates/view/organization-planning/process-slide-powerpoint-template
Product Hunt Pitch Deck Template,https://24slides.com/templates/view/corporate-business-models/product-hunt-pitch-deck-template
Professional Project Proposal PowerPoint Presentation,https://24slides.com/templates/view/corporate-business-models/professional-project-proposal-powerpoint-presentation
Progress Report PowerPoint Template,https://24slides.com/templates/view/corporate-business-models/progress-report-powerpoint-template
Project Analysis PowerPoint Template,https://24slides.com/templates/view/organization-planning/project-analysis-powerpoint-template
Project Budget Presentation Template,https://24slides.com/templates/view/corporate-business-models/project-budget-presentation-template
Project Charter PowerPoint Presentation,https://24slides.com/templates/view/corporate-business-models/project-charter-powerpoint-presentation
Project Kickoff Presentation,https://24slides.com/templates/view/corporate-business-models/project-kickoff-presentation
Project Management PowerPoint Template,https://24slides.com/templates/view/corporate-business-models/project-management-powerpoint-template
Project Management on Technology Infrastructure Template,https://24slides.com/templates/view/corporate-business-models/project-management-on-technology-infrastructure-template
Project Plan PowerPoint Template,https://24slides.com/templates/view/corporate-business-models/project-plan-powerpoint-template
Project Planning Templates,https://24slides.com/templates/view/corporate-business-models/project-planning-templates
Project Status Presentation Template,https://24slides.com/templates/view/corporate-business-models/project-status-presentation-template
Project Timeline PowerPoint Template,https://24slides.com/templates/view/organization-planning/project-timeline-powerpoint-template
Proof of Concept Template for Projects,https://24slides.com/templates/view/corporate-business-models/proof-of-concept-template-for-projects
Puzzle Presentation Template,https://24slides.com/templates/view/other/puzzle-presentation-template
Pyramid Chart PowerPoint Template,https://24slides.com/templates/view/corporate-business-models/pyramid-chart-powerpoint-template
Pyramid Diagrams PowerPoint Template,https://24slides.com/templates/view/corporate-business-models/pyramid-diagrams-powerpoint-template
Pyramid Slide Templates,https://24slides.com/templates/view/corporate-business-models/pyramid-slide-templates
Quad Chart Template for PowerPoint Presentations,https://24slides.com/templates/view/corporate-business-models/quad-chart-template-for-powerpoint-presentations
Quarterly Business Review Template,https://24slides.com/templates/view/corporate-business-models/quarterly-business-review-template
Question and Answer PowerPoint Template,https://24slides.com/templates/view/other/question-and-answer-powerpoint-template
Real Estate PowerPoint Template,https://24slides.com/templates/view/other/real-estate-powerpoint-template
Recycling PowerPoint Template,https://24slides.com/templates/view/other/recycling-powerpoint-template
Remote Work PowerPoint Template,https://24slides.com/templates/view/corporate-business-models/remote-work-powerpoint-template
Research & Development Data Templates,https://24slides.com/templates/view/data-tables-graphs-charts/research-development-data-templates
Research & Development Process Template,https://24slides.com/templates/view/organization-planning/research-development-process-template
Research Data Presentation Templates,https://24slides.com/templates/view/data-tables-graphs-charts/research-data-presentation-templates
Research Report Presentation,https://24slides.com/templates/view/corporate-business-models/research-report-presentation
Research Stage Slide Template,https://24slides.com/templates/view/organization-planning/research-stage-slide-template
Resources Overview Presentation Template,https://24slides.com/templates/view/corporate-business-models/resources-overview-presentation-template
Risk Matrix Presentation Template,https://24slides.com/templates/view/corporate-business-models/risk-matrix-presentation-template
Risk Matrix Presentation Templates,https://24slides.com/templates/view/data-tables-graphs-charts/risk-matrix-presentation-templates
Roles and Responsibilities Presentation Template,https://24slides.com/templates/view/corporate-business-models/roles-and-responsibilities-presentation-template
Root Cause Analysis PowerPoint Template,https://24slides.com/templates/view/corporate-business-models/root-cause-analysis-powerpoint-template
SWOT Analysis PowerPoint Templates,https://24slides.com/templates/view/corporate-business-models/swot-analysis-powerpoint-templates
SWOT Analysis Presentation Templates,https://24slides.com/templates/view/corporate-business-models/swot-analysis-presentation-templates
SWOT PowerPoint Template,https://24slides.com/templates/view/corporate-business-models/swot-powerpoint-template
Sales Flow Presentation Template,https://24slides.com/templates/view/corporate-business-models/sales-flow-presentation-template
Sales Report Presentation Template,https://24slides.com/templates/view/data-tables-graphs-charts/sales-report-presentation-template
Sales Reports Presentation Templates,https://24slides.com/templates/view/data-tables-graphs-charts/sales-reports-presentation-templates
Sales Training Program Presentation Template,https://24slides.com/templates/view/other/sales-training-program-presentation-template
School Themed PowerPoint Template,https://24slides.com/templates/view/other/school-themed-powerpoint-template
Science Gantt PowerPoint Template,https://24slides.com/templates/view/organization-planning/science-gantt-powerpoint-template
Science Graph PowerPoint Template,https://24slides.com/templates/view/data-tables-graphs-charts/science-graph-powerpoint-template
Science Icon Template Pack,https://24slides.com/templates/view/other/science-icon-template-pack
Science Lab PowerPoint Template,https://24slides.com/templates/view/text-slides/science-lab-powerpoint-template
Science Organisation Presentation Template,https://24slides.com/templates/view/organization-planning/science-organisation-presentation-template
Science Pharma PowerPoint Template,https://24slides.com/templates/view/other/science-pharma-powerpoint-template
Science Pie Graph PowerPoint Templates,https://24slides.com/templates/view/data-tables-graphs-charts/science-pie-graph-powerpoint-templates
Scrum Process PowerPoint Template,https://24slides.com/templates/view/organization-planning/scrum-process-powerpoint-template
Signup now,https://24slides.com/templates/register
Six Sigma Project Charter Template,https://24slides.com/templates/view/corporate-business-models/six-sigma-project-charter-template
Smart City PowerPoint Template,https://24slides.com/templates/view/other/smart-city-powerpoint-template
Snow Season Template Pack,https://24slides.com/templates/view/other/snow-season-template-pack
Social Media Analysis PowerPoint Template,https://24slides.com/templates/view/corporate-business-models/social-media-analysis-powerpoint-template
Social Media Icons Template,https://24slides.com/templates/view/other/social-media-icons-template
Soft Consulting Template Pack,https://24slides.com/templates/view/corporate-business-models/soft-consulting-template-pack
Solar Power System PowerPoint Presentation,https://24slides.com/templates/view/other/solar-power-system-powerpoint-presentation
South America Map PowerPoint Template,https://24slides.com/templates/view/maps/south-america-map-powerpoint-template
Space Science Slides Templates,https://24slides.com/templates/view/text-slides/space-science-slides-templates
Spider Chart PowerPoint Template,https://24slides.com/templates/view/data-tables-graphs-charts/spider-chart-powerpoint-template
Stair Diagram PowerPoint Template,https://24slides.com/templates/view/data-tables-graphs-charts/stair-diagram-powerpoint-template
Stakeholder Analysis PowerPoint Template,https://24slides.com/templates/view/corporate-business-models/stakeholder-analysis-powerpoint-template
Star Wars PowerPoint Template,https://24slides.com/templates/view/other/star-wars-powerpoint-template
Star Wars Themed Presentation,https://24slides.com/templates/view/other/star-wars-themed-presentation
Start-up Pitch Deck PowerPoint Template,https://24slides.com/templates/view/corporate-business-models/start-up-pitch-deck-powerpoint-template
Storyboard Artist Presentation,https://24slides.com/templates/view/text-slides/storyboard-artist-presentation
Strategic Business Plan Template,https://24slides.com/templates/view/corporate-business-models/strategic-business-plan-template
Strategic Plan Presentation Template,https://24slides.com/templates/view/corporate-business-models/strategic-plan-presentation-template
Strategy PowerPoint Template Pack,https://24slides.com/templates/view/organization-planning/strategy-powerpoint-template-pack
Strategy Presentation Icons,https://24slides.com/templates/view/other/strategy-presentation-icons
Stylish Food Presentation Template,https://24slides.com/templates/view/other/stylish-food-presentation-template
Summer Internship PowerPoint Template,https://24slides.com/templates/view/other/summer-internship-powerpoint-template
Summer PowerPoint Backgrounds,https://24slides.com/templates/view/other/summer-powerpoint-backgrounds
Supply Chain PowerPoint Template,https://24slides.com/templates/view/corporate-business-models/supply-chain-powerpoint-template
Survey Results PowerPoint Template,https://24slides.com/templates/view/data-tables-graphs-charts/survey-results-powerpoint-template
Swimlane Diagrams for Creative Presentations,https://24slides.com/templates/view/organization-planning/swimlane-diagrams-for-creative-presentations
Tables PowerPoint Template,https://24slides.com/templates/view/data-tables-graphs-charts/tables-powerpoint-template
Tactical Shooter Game Presentation Template,https://24slides.com/templates/view/other/tactical-shooter-game-presentation-template
Teacher Lesson Plan PowerPoint Template,https://24slides.com/templates/view/text-slides/teacher-lesson-plan-powerpoint-template
Team Slides PowerPoint Template,https://24slides.com/templates/view/corporate-business-models/team-slides-powerpoint-template
Tech Slide Deck Template,https://24slides.com/templates/view/other/tech-slide-deck-template
Tech Startup Pitch Deck Template,https://24slides.com/templates/view/corporate-business-models/tech-startup-pitch-deck-template
Technology Creative Icon Pack,https://24slides.com/templates/view/other/technology-creative-icon-pack
Technology Icon Pack,https://24slides.com/templates/view/other/technology-icon-pack
Technology Roadmap Template,https://24slides.com/templates/view/corporate-business-models/technology-roadmap-template
Telehealth PowerPoint Template,https://24slides.com/templates/view/other/telehealth-powerpoint-template
Text Slides Sales Presentation Template,https://24slides.com/templates/view/text-slides/text-slides-sales-presentation-template
Thank You Slides PowerPoint Template,https://24slides.com/templates/view/other/thank-you-slides-powerpoint-template
The Human Brain Presentation Template,https://24slides.com/templates/view/other/the-human-brain-presentation-template
Time Slide Deck PowerPoint Template,https://24slides.com/templates/view/other/time-slide-deck-powerpoint-template
Timeline & Roadmaps Template Package,https://24slides.com/templates/view/organization-planning/timeline-roadmaps-template-package
Timeline Pictures PowerPoint Template,https://24slides.com/templates/view/organization-planning/timeline-pictures-powerpoint-template
Timeline Pictures Template,https://24slides.com/templates/view/organization-planning/timeline-pictures-template
Timeline PowerPoint Template,https://24slides.com/templates/view/organization-planning/timeline-powerpoint-template
