Name, Link
2018 Calendar Template,https://24slides.com/templates/view/organization-planning/2018-calendar-template
2019 Calendar Template,https://24slides.com/templates/view/other/2019-calendar-template
2019 Timeline PowerPoint Template,https://24slides.com/templates/view/organization-planning/2019-timeline-powerpoint-template
26 Slide Corporate Template Pack,https://24slides.com/templates/view/corporate-business-models/26-slide-corporate-template-pack
7S Framework PowerPoint Template,https://24slides.com/templates/view/organization-planning/7s-framework-powerpoint-template
7S Framework Presentation Template,https://24slides.com/templates/view/corporate-business-models/7s-framework-presentation-template
Academic Presentation PowerPoint Template,https://24slides.com/templates/view/corporate-business-models/academic-presentation-powerpoint-template
After Action Review Presentation,https://24slides.com/templates/view/corporate-business-models/after-action-review-presentation
Agenda Business Development,https://24slides.com/templates/view/corporate-business-models/agenda-business-development
Agenda General,https://24slides.com/templates/view/text-slides/agenda-general
Agenda PowerPoint Template,https://24slides.com/templates/view/organization-planning/agenda-powerpoint-template
Analytics PowerPoint Template,https://24slides.com/templates/view/corporate-business-models/analytics-powerpoint-template
Android Mobile Presentation Template Pack,https://24slides.com/templates/view/text-slides/android-mobile-presentation-template-pack
Android Mobile Presentation Templates,https://24slides.com/templates/view/other/android-mobile-presentation-templates
Animated Project Management Template Pack,https://24slides.com/templates/view/corporate-business-models/animated-project-management-template-pack
Area Chart PowerPoint Template,https://24slides.com/templates/view/data-tables-graphs-charts/area-chart-powerpoint-template
Asia Map PowerPoint Template,https://24slides.com/templates/view/maps/asia-map-powerpoint-template
Australia Maps PowerPoint Template,https://24slides.com/templates/view/maps/australia-maps-powerpoint-template
Autism Awareness Presentation Template,https://24slides.com/templates/view/other/autism-awareness-presentation-template
Aviation Slides PowerPoint Template,https://24slides.com/templates/view/other/aviation-slides-powerpoint-template
Award PowerPoint Template,https://24slides.com/templates/view/other/award-powerpoint-template
BCG Matrix Template for Corporate Presentations,https://24slides.com/templates/view/corporate-business-models/bcg-matrix-template-for-corporate-presentations
Bachelor Thesis Presentation Pack,https://24slides.com/templates/view/other/bachelor-thesis-presentation-pack
Balanced Scorecard PowerPoint Template,https://24slides.com/templates/view/corporate-business-models/balanced-scorecard-powerpoint-template
Balanced Scorecard Presentation Template,https://24slides.com/templates/view/corporate-business-models/balanced-scorecard-presentation-template
Basic Icons PowerPoint Template,https://24slides.com/templates/view/other/basic-icons-powerpoint-template
Before After Presentation Slides,https://24slides.com/templates/view/organization-planning/before-after-presentation-slides
Bicycle Safety PowerPoint Template,https://24slides.com/templates/view/other/bicycle-safety-powerpoint-template
Biology PowerPoint Template,https://24slides.com/templates/view/other/biology-powerpoint-template
Block Chain Data PowerPoint Template,https://24slides.com/templates/view/data-tables-graphs-charts/block-chain-data-powerpoint-template
Blue Ocean Strategy,https://24slides.com/templates/view/corporate-business-models/blue-ocean-strategy
Boston Consulting Group PowerPoint Presentation,https://24slides.com/templates/view/corporate-business-models/boston-consulting-group-powerpoint-presentation
Boy Scouts of America PowerPoint Template,https://24slides.com/templates/view/other/boy-scouts-of-america-powerpoint-template
Budget PowerPoint Template,https://24slides.com/templates/view/corporate-business-models/budget-powerpoint-template
Business Calendar Templates,https://24slides.com/templates/view/organization-planning/business-calendar-templates
Business Cards Template,https://24slides.com/templates/view/other/business-cards-template
Business Case PowerPoint Template,https://24slides.com/templates/view/corporate-business-models/business-case-powerpoint-template
Business Case Study Template,https://24slides.com/templates/view/corporate-business-models/business-case-study-template
Business Continuity Advice Presentation,https://24slides.com/templates/view/corporate-business-models/business-continuity-advice-presentation
Business Development Agenda Template,https://24slides.com/templates/view/corporate-business-models/business-development-agenda-template
Business Ethics PowerPoint Template,https://24slides.com/templates/view/text-slides/business-ethics-powerpoint-template
Business Funnel Presentation Template,https://24slides.com/templates/view/corporate-business-models/business-funnel-presentation-template
Business Innovation PowerPoint Presentation,https://24slides.com/templates/view/other/business-innovation-powerpoint-presentation
Business Meeting Invitation Template,https://24slides.com/templates/view/corporate-business-models/business-meeting-invitation-template
Business Mind Maps Template Pack,https://24slides.com/templates/view/maps/business-mind-maps-template-pack
Business Model Canvas Template,https://24slides.com/templates/view/corporate-business-models/business-model-canvas-template
Business Partner Proposal Template,https://24slides.com/templates/view/corporate-business-models/business-partner-proposal-template
Business Plan PowerPoint Presentation,https://24slides.com/templates/view/corporate-business-models/business-plan-powerpoint-presentation
Business Plan Presentation Template,https://24slides.com/templates/view/corporate-business-models/business-plan-presentation-template
Business Presentation Template,https://24slides.com/templates/view/corporate-business-models/business-presentation-template
Business Roadmap PowerPoint Template,https://24slides.com/templates/view/corporate-business-models/business-roadmap-powerpoint-template
Business Roadmap Template,https://24slides.com/templates/view/organization-planning/business-roadmap-template
Business Stage Presentation Template,https://24slides.com/templates/view/corporate-business-models/business-stage-presentation-template
CSR Analysis PowerPoint Template,https://24slides.com/templates/view/corporate-business-models/csr-analysis-powerpoint-template
Calendar Icons Template Pack,https://24slides.com/templates/view/other/calendar-icons-template-pack
Career Portfolio PowerPoint Template,https://24slides.com/templates/view/other/career-portfolio-powerpoint-template
Chalkboard PowerPoint Template,https://24slides.com/templates/view/other/chalkboard-powerpoint-template
China Market Presentation,https://24slides.com/templates/view/text-slides/china-market-presentation
Christmas PowerPoint Template,https://24slides.com/templates/view/other/christmas-powerpoint-template
Circle Diagrams Presentation Templates,https://24slides.com/templates/view/organization-planning/circle-diagrams-presentation-templates
Client Case Study Template,https://24slides.com/templates/view/corporate-business-models/client-case-study-template
Cloud Computing PowerPoint Template,https://24slides.com/templates/view/other/cloud-computing-powerpoint-template
Cockpit Chart Presentation Template,https://24slides.com/templates/view/data-tables-graphs-charts/cockpit-chart-presentation-template
Cockpit Chart Templates,https://24slides.com/templates/view/data-tables-graphs-charts/cockpit-chart-templates
Comic Book Themed PowerPoint Template,https://24slides.com/templates/view/other/comic-book-themed-powerpoint-template
Company Events Calendar PowerPoint Template,https://24slides.com/templates/view/organization-planning/company-events-calendar-powerpoint-template
Company Family Tree Template,https://24slides.com/templates/view/other/company-family-tree-template
Company Organizational Chart Template,https://24slides.com/templates/view/corporate-business-models/company-organizational-chart-template
Comparison Business Development Templates,https://24slides.com/templates/view/corporate-business-models/comparison-business-development-templates
Comparison Management Templates,https://24slides.com/templates/view/corporate-business-models/comparison-management-templates
Competitor Analysis PowerPoint Template,https://24slides.com/templates/view/corporate-business-models/competitor-analysis-powerpoint-template
Competitor PowerPoint Template,https://24slides.com/templates/view/corporate-business-models/competitor-powerpoint-template
Complete Business Case Presentation Template,https://24slides.com/templates/view/corporate-business-models/complete-business-case-presentation-template
Consulting PowerPoint Template,https://24slides.com/templates/view/corporate-business-models/consulting-powerpoint-template
Consulting Presentation Template,https://24slides.com/templates/view/corporate-business-models/consulting-presentation-template
Consulting and Business Services Icon,https://24slides.com/templates/view/other/consulting-and-business-services-icon
Cool Math Lesson Template,https://24slides.com/templates/view/other/cool-math-lesson-template
Copywriter Pitch Deck PowerPoint Template,https://24slides.com/templates/view/corporate-business-models/copywriter-pitch-deck-powerpoint-template
Corporate Account Management Plan Template,https://24slides.com/templates/view/corporate-business-models/corporate-account-management-plan-template
Corporate Agenda PowerPoint Template,https://24slides.com/templates/view/organization-planning/corporate-agenda-powerpoint-template
Corporate Checklist PowerPoint Template,https://24slides.com/templates/view/organization-planning/corporate-checklist-powerpoint-template
Corporate Colour Icon Pack,https://24slides.com/templates/view/other/corporate-colour-icon-pack
Corporate Data Presentation Template Pack,https://24slides.com/templates/view/corporate-business-models/corporate-data-presentation-template-pack
Corporate Gantt Chart,https://24slides.com/templates/view/corporate-business-models/corporate-gantt-chart
Corporate Hierarchy Template,https://24slides.com/templates/view/corporate-business-models/corporate-hierarchy-template
Corporate PEST Analysis Template,https://24slides.com/templates/view/corporate-business-models/corporate-pest-analysis-template
Corporate Package of 20 Slides,https://24slides.com/templates/view/corporate-business-models/corporate-package-of-20-slides
Corporate Porter’s Five Forces PowerPoint Template,https://24slides.com/templates/view/corporate-business-models/corporate-porters-five-forces-powerpoint-template
Corporate PowerPoint Template Pack,https://24slides.com/templates/view/corporate-business-models/corporate-powerpoint-template-pack
Corporate Process Improvement Template,https://24slides.com/templates/view/corporate-business-models/corporate-process-improvement-template
Corporate Project Proposal Presentation,https://24slides.com/templates/view/corporate-business-models/corporate-project-proposal-presentation
Corporate Stakeholder Map Template,https://24slides.com/templates/view/corporate-business-models/corporate-stakeholder-map-template
Corporate Succession Planning PowerPoint Template,https://24slides.com/templates/view/corporate-business-models/corporate-succession-planning-powerpoint-template
Corporate Swimlane Diagrams Template,https://24slides.com/templates/view/corporate-business-models/corporate-swimlane-diagrams-template
Corporate Title Slides | PowerPoint Template Pack,https://24slides.com/templates/view/other/corporate-title-slides-powerpoint-template-pack
Corporate User Journey PowerPoint Template,https://24slides.com/templates/view/corporate-business-models/corporate-user-journey-powerpoint-template
Cost-Benefit Analysis PowerPoint,https://24slides.com/templates/view/corporate-business-models/cost-benefit-analysis-powerpoint
Creative 2019 Calendar PowerPoint Template,https://24slides.com/templates/view/other/creative-2019-calendar-powerpoint-template
Creative 30 60 90 Business Plan Template,https://24slides.com/templates/view/corporate-business-models/creative-30-60-90-business-plan-template
Creative 30 Slide Mega Pack PowerPoint Template,https://24slides.com/templates/view/corporate-business-models/creative-30-slide-mega-pack-powerpoint-template
Creative Animated Finance Template Pack,https://24slides.com/templates/view/corporate-business-models/creative-animated-finance-template-pack
Creative Animated Marketing PowerPoint Template,https://24slides.com/templates/view/corporate-business-models/creative-animated-marketing-powerpoint-template
Creative Animated Pharmaceutical PowerPoint Template,https://24slides.com/templates/view/other/creative-animated-pharmaceutical-powerpoint-template
Creative Animated Timeline Presentation Template,https://24slides.com/templates/view/organization-planning/creative-animated-timeline-presentation-template
Creative Area Chart PowerPoint Template,https://24slides.com/templates/view/data-tables-graphs-charts/creative-area-chart-powerpoint-template
Creative Autumn PowerPoint Template,https://24slides.com/templates/view/other/creative-autumn-powerpoint-template
Creative Business Model Canvas Template,https://24slides.com/templates/view/corporate-business-models/creative-business-model-canvas-template
Creative Certificate Template,https://24slides.com/templates/view/text-slides/creative-certificate-template
Creative Chalkboard Template,https://24slides.com/templates/view/corporate-business-models/creative-chalkboard-template
Creative Chinese Presentation,https://24slides.com/templates/view/other/creative-chinese-presentation
Creative Chocolate Presentation,https://24slides.com/templates/view/other/creative-chocolate-presentation
Creative Competitor Analysis Template,https://24slides.com/templates/view/corporate-business-models/creative-competitor-analysis-template
Creative Congratulatory PowerPoint Template,https://24slides.com/templates/view/other/creative-congratulatory-powerpoint-template
Creative Dot Charts PowerPoint Template,https://24slides.com/templates/view/data-tables-graphs-charts/creative-dot-charts-powerpoint-template
Creative Education Icons,https://24slides.com/templates/view/other/creative-education-icons
Creative Education PowerPoint Template,https://24slides.com/templates/view/corporate-business-models/creative-education-powerpoint-template
Creative Empathy Map Presentation Template,https://24slides.com/templates/view/other/creative-empathy-map-presentation-template
Creative Engineering Icons,https://24slides.com/templates/view/other/creative-engineering-icons
Creative First Aid Template,https://24slides.com/templates/view/other/creative-first-aid-template
Creative Fishbone Diagram Templates,https://24slides.com/templates/view/corporate-business-models/creative-fishbone-diagram-templates
Creative Flowchart Presentation Template,https://24slides.com/templates/view/organization-planning/creative-flowchart-presentation-template
Creative Flyer Template,https://24slides.com/templates/view/other/creative-flyer-template
Creative Game Show PowerPoint Template,https://24slides.com/templates/view/other/creative-game-show-powerpoint-template
Creative Germany Template,https://24slides.com/templates/view/other/creative-germany-template
Creative KPI Scorecard Templates,https://24slides.com/templates/view/corporate-business-models/creative-kpi-scorecard-templates
Creative Kanban Board PowerPoint Template,https://24slides.com/templates/view/organization-planning/creative-kanban-board-powerpoint-template
Creative Keynote Conference PowerPoint Template,https://24slides.com/templates/view/text-slides/creative-keynote-conference-powerpoint-template
Creative Marketing Strategy Template,https://24slides.com/templates/view/corporate-business-models/creative-marketing-strategy-template
Creative Personal Resume PowerPoint Template,https://24slides.com/templates/view/other/creative-personal-resume-powerpoint-template
Creative Pharmaceutical Icons,https://24slides.com/templates/view/other/creative-pharmaceutical-icons
Creative Photo Album Template,https://24slides.com/templates/view/other/creative-photo-album-template
Creative Pitch Deck PowerPoint Template,https://24slides.com/templates/view/corporate-business-models/creative-pitch-deck-powerpoint-template
Creative Pitchbook Template,https://24slides.com/templates/view/corporate-business-models/creative-pitchbook-template
Creative Polka Dot Presentation Template,https://24slides.com/templates/view/text-slides/creative-polka-dot-presentation-template
Creative Process Flow PowerPoint Template,https://24slides.com/templates/view/other/creative-process-flow-powerpoint-template
Creative Process Slides PowerPoint Template,https://24slides.com/templates/view/organization-planning/creative-process-slides-powerpoint-template
Creative Product Launch PowerPoint Template,https://24slides.com/templates/view/corporate-business-models/creative-product-launch-powerpoint-template
Creative Product Roadmap Presentation,https://24slides.com/templates/view/corporate-business-models/creative-product-roadmap-presentation
Creative Production Process PowerPoint Template,https://24slides.com/templates/view/corporate-business-models/creative-production-process-powerpoint-template
Creative RACI Matrix Template,https://24slides.com/templates/view/corporate-business-models/creative-raci-matrix-template
Creative Research Poster Template,https://24slides.com/templates/view/other/creative-research-poster-template
Creative Resume Template,https://24slides.com/templates/view/corporate-business-models/creative-resume-template
Creative Superhero PowerPoint Template,https://24slides.com/templates/view/other/creative-superhero-powerpoint-template
Creative Swimlane PowerPoint Slides,https://24slides.com/templates/view/other/creative-swimlane-powerpoint-slides
Creative Table of Contents Template,https://24slides.com/templates/view/organization-planning/creative-table-of-contents-template
Creative Timeline PowerPoint Template Pack,https://24slides.com/templates/view/organization-planning/creative-timeline-powerpoint-template-pack
Creative Traffic Light Template,https://24slides.com/templates/view/text-slides/creative-traffic-light-template
Creative Volcano PowerPoint Presentation,https://24slides.com/templates/view/other/creative-volcano-powerpoint-presentation
Creative Waterfall Template Pack,https://24slides.com/templates/view/organization-planning/creative-waterfall-template-pack
Creative Waves PowerPoint Template,https://24slides.com/templates/view/other/creative-waves-powerpoint-template
Creative Workflow Template,https://24slides.com/templates/view/corporate-business-models/creative-workflow-template
Creative World Map PowerPoint Template,https://24slides.com/templates/view/maps/creative-world-map-powerpoint-template
Customer Journey Analysis Template,https://24slides.com/templates/view/corporate-business-models/customer-journey-analysis-template
Customer Journey Map Template,https://24slides.com/templates/view/corporate-business-models/customer-journey-map-template
Customer Service Training PowerPoint Template,https://24slides.com/templates/view/corporate-business-models/customer-service-training-powerpoint-template
Dark themed 30 Slide Template Pack,https://24slides.com/templates/view/other/dark-themed-30-slide-template-pack
Dashboard Template Pack,https://24slides.com/templates/view/data-tables-graphs-charts/dashboard-template-pack
Data Driven 3,https://24slides.com/templates/view/data-tables-graphs-charts/data-driven-3
Data Driven Collection PowerPoint Template,https://24slides.com/templates/view/data-tables-graphs-charts/data-driven-collection-powerpoint-template
Data Driven Financial Templates,https://24slides.com/templates/view/data-tables-graphs-charts/data-driven-financial-templates
Data Driven PowerPoint Templates,https://24slides.com/templates/view/data-tables-graphs-charts/data-driven-powerpoint-templates
Data Driven Slides Templates,https://24slides.com/templates/view/data-tables-graphs-charts/data-driven-slides-templates
Decision Tree Templates,https://24slides.com/templates/view/corporate-business-models/decision-tree-templates
Digital Marketing PowerPoint Template,https://24slides.com/templates/view/corporate-business-models/digital-marketing-powerpoint-template
Digital Marketing Presentation Template,https://24slides.com/templates/view/other/digital-marketing-presentation-template
Digital Marketing Presentation Templates,https://24slides.com/templates/view/text-slides/digital-marketing-presentation-templates
Digital Technology PowerPoint Template,https://24slides.com/templates/view/other/digital-technology-powerpoint-template
Digital Transformation PowerPoint Template,https://24slides.com/templates/view/corporate-business-models/digital-transformation-powerpoint-template
Driver Diagrams Template Pack,https://24slides.com/templates/view/corporate-business-models/driver-diagrams-template-pack
Egypt Presentation Template,https://24slides.com/templates/view/other/egypt-presentation-template
Electric Power Company Presentation Template,https://24slides.com/templates/view/other/electric-power-company-presentation-template
Employee Awards PowerPoint Template,https://24slides.com/templates/view/other/employee-awards-powerpoint-template
Energy PowerPoint Template,https://24slides.com/templates/view/other/energy-powerpoint-template
Engineering Project Management Presentation Template,https://24slides.com/templates/view/corporate-business-models/engineering-project-management-presentation-template
Environment Deck PowerPoint Template,https://24slides.com/templates/view/other/environment-deck-powerpoint-template
Europe Map PowerPoint Template,https://24slides.com/templates/view/maps/europe-map-powerpoint-template
Executive Summary Template for Corporate Presentations,https://24slides.com/templates/view/corporate-business-models/executive-summary-template-for-corporate-presentations
Explaining 'How' Presentation Template,https://24slides.com/templates/view/organization-planning/explaining-how-presentation-template
Explaining the "Who and Where" Presentation Template,https://24slides.com/templates/view/organization-planning/explaining-the-who-and-where-presentation-template
Explaining the 'What' Templates,https://24slides.com/templates/view/organization-planning/explaining-the-what-templates
Fall Season PowerPoint Template,https://24slides.com/templates/view/other/fall-season-powerpoint-template
Fashion PowerPoint Template,https://24slides.com/templates/view/other/fashion-powerpoint-template
Fast Food PowerPoint Template,https://24slides.com/templates/view/other/fast-food-powerpoint-template
Film Pitch Deck Template,https://24slides.com/templates/view/other/film-pitch-deck-template
Finance PowerPoint Template Mini Pack,https://24slides.com/templates/view/corporate-business-models/finance-powerpoint-template-mini-pack
Financial Data Driven PowerPoint Templates,https://24slides.com/templates/view/data-tables-graphs-charts/financial-data-driven-powerpoint-templates
Financial Icons,https://24slides.com/templates/view/other/financial-icons
Financial Icons PowerPoint Template,https://24slides.com/templates/view/other/financial-icons-powerpoint-template
Financial Matrix PowerPoint Template,https://24slides.com/templates/view/data-tables-graphs-charts/financial-matrix-powerpoint-template
Financial Pie Graphs PowerPoint Templates,https://24slides.com/templates/view/data-tables-graphs-charts/financial-pie-graphs-powerpoint-templates
Financial SWOT PowerPoint Templates,https://24slides.com/templates/view/data-tables-graphs-charts/financial-swot-powerpoint-templates
Flow Chart PowerPoint Template,https://24slides.com/templates/view/data-tables-graphs-charts/flow-chart-powerpoint-template
Flowchart Presentation Templates,https://24slides.com/templates/view/organization-planning/flowchart-presentation-templates
Food and Drink Playful Icons,https://24slides.com/templates/view/other/food-and-drink-playful-icons
Football Game Plan Presentation Template,https://24slides.com/templates/view/text-slides/football-game-plan-presentation-template
Freelance Marketer Sales Deck Template,https://24slides.com/templates/view/corporate-business-models/freelance-marketer-sales-deck-template
Fun Quiz PowerPoint Template,https://24slides.com/templates/view/text-slides/fun-quiz-powerpoint-template
Fun Superheroes Story PowerPoint Template,https://24slides.com/templates/view/other/fun-superheroes-story-powerpoint-template
GAP Analysis PowerPoint Template,https://24slides.com/templates/view/corporate-business-models/gap-analysis-powerpoint-template
Galaxy Themed PowerPoint Template,https://24slides.com/templates/view/other/galaxy-themed-powerpoint-template
Gantt Chart Templates for Project Presentations,https://24slides.com/templates/view/corporate-business-models/gantt-chart-templates-for-project-presentations
Gears for PowerPoint Presentations,https://24slides.com/templates/view/other/gears-for-powerpoint-presentations
General Agenda Presentation Template,https://24slides.com/templates/view/text-slides/general-agenda-presentation-template
General PowerPoint Icons Template,https://24slides.com/templates/view/other/general-powerpoint-icons-template
General Sales Slides Templates,https://24slides.com/templates/view/text-slides/general-sales-slides-templates
Generic Data Driven PowerPoint Template,https://24slides.com/templates/view/data-tables-graphs-charts/generic-data-driven-powerpoint-template
Generic Mobile Pack Templates,https://24slides.com/templates/view/other/generic-mobile-pack-templates
